{
  "$schema": "./brand-profile.schema.json",
  "themeMode": "light",
  "brand": {
    "name": "Jumio",
    "sourceUrl": "https://www.jumio.com/",
    "logo": "https://documentation.jumio.ai/img/Jumio-Logo-color/Jumio23-RGB.svg",
    "fontFamily": "Inter",
    "fontUrl": "https://fonts.googleapis.com/css2?family=Inter:wght@400;500;600&display=swap",
    "colors": {
      "primary": "#00D06A",
      "onPrimary": "#ffffff",
      "text": "#121214",
      "pageBackground": "#ffffff",
      "cardBackground": "#f7f8fa"
    },
    "radius": "16px"
  },
  "journey": {
    "vertical": "identity",
    "steps": ["Create Account", "Scan ID Document", "Take a Selfie", "Verification Complete"],
    "idvStepIndex": 1,
    "ctaLabel": "Verify your identity"
  },
  "sdk": {
    "workflow": "id+selfie",
    "locale": "en"
  },
  "layout": {
    "containerPadding": { "top": "2em", "right": "1em", "bottom": "2em", "left": "1em" }
  },
  "advanced": {
    "tokenOverrides": {}
  }
}
