{
  "$schema": "./brand-profile.schema.json",
  "themeMode": "light",
  "brand": {
    "name": "Bybit",
    "sourceUrl": "https://www.bybit.com/en-GB/",
    "logo": "https://upload.wikimedia.org/wikipedia/commons/1/14/Bybit_Logo.svg",
    "fontFamily": "Inter",
    "fontUrl": "https://fonts.googleapis.com/css2?family=Inter:wght@400;500;600&display=swap",
    "colors": {
      "primary": "#FF9B26",
      "onPrimary": "#ffffff",
      "text": "#121214",
      "pageBackground": "#ffffff",
      "cardBackground": "#f7f8fa"
    },
    "radius": "16px"
  },
  "journey": {
    "vertical": "crypto",
    "steps": ["Create Account", "Verify Identity", "Make Deposit", "Start Trading"],
    "idvStepIndex": 1,
    "ctaLabel": "Verify your identity"
  },
  "sdk": {
    "workflow": "id+selfie",
    "locale": "en"
  },
  "layout": {
    "containerPadding": { "top": "2em", "right": "1em", "bottom": "2em", "left": "1em" }
  },
  "advanced": {
    "tokenOverrides": {}
  }
}
