{
  "$schema": "./brand-profile.schema.json",
  "themeMode": "light",
  "brand": {
    "name": "Okada Manila",
    "sourceUrl": "https://okadamanila.com/",
    "logo": "https://upload.wikimedia.org/wikipedia/commons/e/ea/Okada_Manila_logo.png",
    "fontFamily": "Cinzel",
    "fontUrl": "https://fonts.googleapis.com/css2?family=Cinzel:wght@400;500;600&display=swap",
    "colors": {
      "primary": "#70135B",
      "onPrimary": "#f3d9b1",
      "text": "#1e1e1e",
      "pageBackground": "#ffffff",
      "cardBackground": "#f8f6f0"
    },
    "radius": "2px"
  },
  "journey": {
    "vertical": "hospitality",
    "steps": ["Select room", "Verify identity", "Done"],
    "idvStepIndex": 1,
    "ctaLabel": "Verify your identity"
  },
  "sdk": {
    "workflow": "id+selfie",
    "locale": "en"
  },
  "layout": {
    "containerPadding": { "top": "2em", "right": "1em", "bottom": "2em", "left": "1em" }
  },
  "advanced": {
    "tokenOverrides": {}
  }
}
